{
	"$schema": "../../../../../../docs/schemas/admin-engine-v2.json",
	"id": "core:minimal-engine",
	"version": 1,
	"title": "Minimal Engine",
	"specializes-roles": [ "main" ],
	"honored-platform": [ "modal" ],
	"templates": {
		"core:main": {
			"role": "main"
		}
	},
	"default-arrangement": "single-pane",
	"script": "core-minimal-engine"
}
